,titulo,clasificacion,duracion,genero,año,tipo_de_audio,sinopsis
95,Extraordinario online,ATP,113 MIN,DRAMA,2017,SONIDO ENVOLVENTE 5.1,"Tanto su familia como sus compañeros de clases y la comunidad en general luchan por encontrar la compasión y la aceptación, el extraordinario viaje de Auggie los unirá y les probará que no puedes"
96,La reina online,SAM13,103 MIN,"BIOGRÁFICA, DRAMA",2006,SONIDO ENVOLVENTE 5.1,Hellen Mirren ganó el Oscar a Mejor Actriz en 2006 por su brillante retrato de la Reina Isabel cuando lidiaba con la trágica muerte de la Princesa Diana.
97,Golpe en londres online,SAM16,95 MIN,ACCIÓN,2017,ESTÉREO,"Un atraco a un banco sale mal y alguien es asesinado, pero las cosas pueden no ser lo que parecen."
98,De Tyler Perry: ¿Por qué me casé también? online,SAM13,120 MIN,"COMEDIA, DRAMA",2010,SONIDO ENVOLVENTE 5.1,"Con el mismo elenco carismático de la exitosa comedia dramática, ""¿Por qué me casé?"", Tyler Perry nos trae el siguiente capítulo en la vida de ocho amigos de la universidad que luchan con los desafíos"
99,El sorprendente Hombre-Araña 2 - La amenaza de Electro online,SAM13,141 MIN,"ACCIÓN, DE AVENTURAS",2014,SONIDO ENVOLVENTE 5.1,"Ser el Hombre Araña (Andrew Garfield) es genial. Para Peter Parker, no hay mejor sensación que columpiarse entre rascacielos, ser el héroe y pasar el tiempo con Gwen (Emma Stone)."
100,El árbol de Navidad online,ATP,87 MIN,"NAVIDEÑA, DRAMA",2014,ESTÉREO,"Cuando la chica de la gran ciudad (Lacey Chabert) regresa para salvar la el vivero de árboles de su infancia, tal vez puede redescubrir más de lo que quería, incluyendo a su amor verdadero."
101,Pobres divas online,SAM13,106 MIN,"ROMÁNTICA, COMEDIA",2011,ESTÉREO,"Nora y Mary Domínguez, dos hermanas que llevan una vida fácil y llena de lujos en Beverly Hills, lo pierden todo cuando su padre muere súbitamente. Las hermanas van a vivir con su tía a Los Ángeles"
102,Elizabeth: La edad de oro online,SAM13,114 MIN,"ACCIÓN, DE AVENTURAS",2007,SONIDO ENVOLVENTE 5.1,"Cate Blanchett y Geoffrey Rush protagonizan esta emocionante historia de la lucha de una mujer para controlar el amor, aplastar a sus enemigos y consolidarse en el trono de Inglaterra."
103,La novia de mi mejor amigo online,SAM16,100 MIN,"COMEDIA, ROMÁNTICA",2008,SONIDO ENVOLVENTE 5.1,Tank (Dane Cook) se enfrenta a la mayor prueba de amistad posible cuando su mejor amigo (Jason Biggs) lo contrata para que llevé a su ex novia (Kate Hudson) a una pésima cita con el fin de que note lo
104,Día del atentado online,SAM16,133 MIN,"ACCIÓN, DRAMA",2016,SONIDO ENVOLVENTE 5.1,La historia del bombardeo de la maratón de Boston del 2013 y la búsqueda de personas en la ciudad para encontrar a los terroristas responsables.
105,Querido Santa Secreto online,ATP,89 MIN,"NAVIDEÑA, DRAMA",2013,ESTÉREO,"Tatyana Ali estelariza en esta película llena de estrellas, incluyendo a Jordin Sparks, Ernie Hudson y Della Reese. ¡Es un reconfortante romance navideño!"
106,De Tyler Perry: El club de las madres solteras online,SAM13,111 MIN,"COMEDIA, DRAMA",2014,SONIDO ENVOLVENTE 5.1,"Cinco madres solteras en problemas dejan de lado sus diferencias para formar un grupo de apoyo, hallan inspiración y humor en su nueva hermandad y se ayudan mutuamente para superar los obstáculos que"
107,Father Figures online,SAM16,112 MIN,COMEDIA,2017,SONIDO ENVOLVENTE 5.1,"Dos hermanos mellizos crecieron pensando que su padre había muerto, pero descubren que está vivo y emprenden un viaje para encontrarlo. No será sencillo, ya que su madre se acostó con muchos hombres"
108,El legado online,SAM13,102 MIN,"ACCIÓN, CIENCIA FICCIÓN",2018,SONIDO ENVOLVENTE 5.1,"Un exconvicto recientemente liberado y su hermano menor, adoptivo, se ven obligados a huir. Al ser perseguidos por un criminal vengativo, los federales y un grupo de soldados de otro mundo,"
109,El Justiciero online,SAM16,131 MIN,"ACCIÓN, DRAMA",2014,SONIDO ENVOLVENTE 5.1,Un ex-comando sale del retiro y pone sus habilidades especiales a trabajar para rescatar a una chica que está bajo el control de unos criminales rusos. What do you see when you look at me? Basada en
